句子,关键词位置,原始关键词,对立关键词
据我们观察，这方面男明星的情况其实相对还比较好，通常采取的都是运动加合理饮食的方式。,"[9, 10]",男,女
据新华社电北京时间2月27日，国际篮联日公布了最新一期世界排名，男篮世界杯8支抽签种子球队随之确定，东道主中国队以及卫冕冠军美国队在此行列。,"[32, 33]",男,女
据此前报道，9岁男童被殴致死的视频传开后，部分网友质疑围观者的冷漠。,"[8, 9]",男,女
据民警了解，事发前出租屋男租客曾在卫生间洗澡，洗澡出来后发现全身无力，随即拨打120求救，刚说完地址就意识模糊了。,"[12, 13]",男,女
据深圳梅林幼儿园多名家长反映，幼儿园老师对班上男童下体进行拍摄，并标注姓名及出生年月发给学校教官及一名“老中医”。,"[23, 24]",男,女
据网友上传的视频显示，有两名男童被砍伤后倒地，伤口流血较多，已经浸透伤者身上的衣物。,"[14, 15]",男,女
据说，校内只有一间男厕所。,"[9, 10]",男,女
掀开石板后，露出一只装矿泉水的纸箱，打开箱子，里面果然是一个男婴，身上裹着一床被子。,"[31, 32]",男,女
排练过程中，演员们泡在水里贴身衣服湿透，手脚绑在翻转的地板上常是青一块紫一块，男演员更是在半年内减重40斤。,"[39, 40]",男,女
探索因性施教、按性设岗，充分发挥男幼师从教具有的性别特色，开展幼儿体能训练、科学探究、户外活动、安全教育等课程。,"[22, 23]",男,女
接下来新疆队将奔赴太原，于12月10日挑战本赛季战绩出色的山西男篮。,"[31, 32]",男,女
接下来，男方父母的工作就好做多了。,"[4, 5]",男,女
接到报警后，肥东警方仅仅用时不到10分钟，就将男童成功救出。,"[23, 24]",男,女
接到警情后，民警及时出警，在寒冷的海风中积极施救，很快将男青年救助上岸。,"[28, 29]",男,女
接报民警赶到时，孕妇已产下一名男婴，脐带还连着母体。,"[15, 16]",男,女
接着某男演员的丑闻上升到刑事案件浮出水面，耸人听闻。,"[3, 4]",男,女
接警后，指挥中心立即向新郑市公安局主管领导汇报并指派相关单位迅速开展工作，经法医初步判断该无名男尸因交通事故死亡。,"[48, 49]",男,女
"摩羯男觉得这简直就是睁着眼睛说瞎话,明明打过去的时候还是接通的,而后明显是被人按掉了。","[2, 3]",男,女
摸排了两天，依然没有查到符合遗弃男婴的信息。,"[16, 17]",男,女
放学路上，一条黑色狼狗突然蹿出，对着公交站牌下的8岁男童昊昊一通撕咬着。,"[26, 27]",男,女
故事1：张某男38岁，经常加班应酬，喜饮酒、吃火锅，工作压力大、睡眠差，时常发生口腔溃疡，漱口水的对症处理能够缓解一时疼痛但一直未能根治。,"[13, 14]",男,女
故此，中国男足在用人方面其实已经不存在“遗珠”。,"[5, 6]",男,女
教我们班生物的，是一位中年男老师。,"[13, 14]",男,女
教练配置华丽且实用，让男球迷心服口服。,"[11, 12]",男,女
敢在中国男排处于低谷之际出山，其老骥伏枥、志在千里的勇气和担当赢得球迷们的敬重。,"[4, 5]",男,女
整个电影节奏缓慢看的也很混乱、颠三倒四的故事情节可能是为了突显男主角复杂的内心戏，但却描述太多，缺少亮点。,"[32, 33]",男,女
整座建筑之所以富丽堂皇、工程浩大，是动用了昂拉八庄所有男劳力，耗时三四年，仅木料就将当顺乡东果村一座山头最好的松树林伐完了。,"[27, 28]",男,女
整部影片显得略微沉重，尤其是对男主人公跟踪和偷窥等细节的描摹，更是有些压抑。,"[38, 39]",男,女
文章讲述了男主人公――一个寒门子弟逆袭成为高考状元，最终又被厄运击倒患病身亡。,"[5, 6]",男,女
新一拨的100位男练习生，将在三个月内接受全民票选，最终胜出的9人将集结成团出道。,"[8, 9]",男,女
新京报7月15日刊发“男记者卧底微整形速成班”的调查报道。,"[11, 12]",男,女
新华社对其男主播进行了一系列升级。,"[6, 7]",男,女
新赛季首场比赛，上海男篮给人的感觉，似乎没有赛前预料得那么强。,"[10, 11]",男,女
旁边的展品介绍说，结婚不到两年的婚姻便以男主角的出轨结束。,"[20, 21]",男,女
无奈真的是圈子有限，身边的人不是已婚就是比自己还小，找个合适的男朋友真的好难！,"[31, 32]",男,女
无工作男职工配偶补贴，失业证办理日期应在新生儿出生日期之前。,"[5, 6]",男,女
无法把这故事讲得更简单，因为男频故事脱了打怪升级就等于基因重新编辑；也无法把这故事讲得更复杂，因为近四百万字的小说本身已是一张天罗地网，网文就是蜘蛛狩猎，总要能确保至少一根丝够黏，能捕获数据。,"[14, 15]",男,女
无独有偶，12月2日深夜，一名25岁男租客被发现倒在柳州市龙屯路一处民房内，被发现时已经没有生命迹象，死因疑似一氧化碳中毒。,"[18, 19]",男,女
无独有偶，中国男乒队长马龙也正处伤病恢复关键期。,"[7, 8]",男,女
无论奥运梦圆满与否，中国男排的未来不会随着奥运资格赛或是奥运会的举行而画下句点。,"[12, 13]",男,女
无论是从体育还是性别教育上，让幼儿园拥有男老师也成为不少家长的新诉求。,"[20, 21]",男,女
日前，厦门一名9岁的男童在食用河豚后中毒，所幸经过医院重症监护室救治，现已逐渐康复。,"[10, 11]",男,女
日前，有网友发现在多档综艺节目中，多位男艺人都被打马赛克遮住了耳钉。,"[27, 28]",男,女
日前，来自云南的6岁独龙族男童在泰达国际心血管病医院完成了心脏手术，并康复出院。,"[13, 14]",男,女
日前，男青年小赵在临港公寓门口打车到临港某工厂，付车费时，司机表示车费太少。,"[3, 4]",男,女
日前，记者来到科大先进计算机体系结构实验室，听听这群热爱计算机的“理工男们”，讲述自己与编程的故事。,"[35, 36]",男,女
日本体操男队也对中国队的实力赞赏有加。,"[4, 5]",男,女
日本足球的发展得益于校园足球，同样，日本的高中男排联赛也风靡全国，是球星涌现的舞台。,"[38, 39]",男,女
早产的男婴有没后遗症、遗传等问题，全家都很担心。,"[3, 4]",男,女
早教市场人才需求量逐年增加，幼教人才除了向往大城市也开始青睐县城幼儿园，男毕业生一生难求。,"[36, 37]",男,女
时间一分一秒过去，男青年拿刀的手始终没有放下。,"[9, 10]",男,女
时间长了，小文摸索出了一套和钢铁直男的相处模式。,"[17, 18]",男,女
时隔两个赛季，上海男乒重回乒超四强。,"[9, 10]",男,女
明年6月中国男篮将会迎来奥运落选赛的挑战，伤兵满营的国家队真的伤不起了。,"[6, 7]",男,女
明明身处夏秋更替时节，中国男篮却在家门口体会了“一秒入冬”的凛冽。,"[13, 14]",男,女
春节期间，长垣县11岁的男童单某眼睛忽然看不见了，心急如焚的家长开车带孩子来到了郑州市二院。,"[12, 13]",男,女
春节长假后，我第三次路过这里，看到提示牌不见了，但公厕里面男卫生间的大便池还是不能用。,"[29, 30]",男,女
昨天男团小组赛第三轮结束后，赛会举行了淘汰赛阶段的抽签仪式。,"[2, 3]",男,女
昨天的比赛上海男篮赢得这么艰难，是赛前球迷们没有料到的。,"[7, 8]",男,女
昨天记者探班现场，也欣赏了男主角与孩子们演绎的3首歌曲。,"[13, 14]",男,女
昨天，一位之前光顾过的男顾客，特意又买票进故宫买了我们的熏肉大饼，说是要再沾点喜气。,"[12, 13]",男,女
昨日上午，在发现不雅小广告的两处男公共卫生间，记者注意到，原喷涂的小广告已经不见了踪影。,"[16, 17]",男,女
昨日上午，记者联系到了捡包的男邻居。,"[14, 15]",男,女
昨晚球迷惊喜地发现，山东男篮这一次终于换上了一身白色队服。,"[12, 13]",男,女
是什么事情要忙到连陪陪心爱的男朋友的时间都没有了?,"[14, 15]",男,女
显然，不少碧桂园的机器人诞生下来就注定是“工程男”。,"[23, 24]",男,女
显然，在集训开始之前，中国男足新一任主教练的人选必须敲定。,"[13, 14]",男,女
晕倒男乘客慢慢恢复意识后，说自己从兰州坐飞机到武汉，下飞机后直接坐地铁准备前往武昌火车站，转乘火车回赤壁老家，由于连续赶路加上没有吃早餐，身体吃不消晕倒了。,"[2, 3]",男,女
更让我讨厌的就是我认为这男的太不正经，和小桃认识没多久，两个人聊天时就胡说八道，还给小桃发各种不雅视频，小桃不仅不生气，还总傻乐。,"[12, 13]",男,女
更重要的是，球迷都希望2019年是个新的开始，中国男足能走出以往的怪圈，不再原地踏步。,"[25, 26]",男,女
曾与男民警搭档，化装侦查，多次成功发现嫌疑人员。,"[2, 3]",男,女
曾有顾客评价，会所内有很多男模，但该店很快从该点评网站下架。,"[35, 36]",男,女
曾朝福于2016年8月3日在重庆市九龙坡区中梁山田坝桥弯铁路边拾得男婴一个，单被包好并附有纸条显示2016年8月1日出生。,"[33, 34]",男,女
曾经以硬朗、顽强闻名的朝鲜男足，这是怎么啦？,"[13, 14]",男,女
曾经备受追捧的英武阳刚的男明星，竟在不知不觉中被替换成了“奶油小生”，这也引发了我的思索：审美变幻无穷，可究竟怎样的美才是永恒的？,"[44, 45]",男,女
最佳男主角奖项争夺同样激烈。,"[2, 3]",男,女
最佳男主角的竞争很胶着。,"[2, 3]",男,女
最初，两家都排斥老马的到来，尤其是男方家，竟然把老马给轰了出来。,"[17, 18]",男,女
最后一名男乘客上车时回头看了一下地上，但没有任何举动，打完卡继续往车厢后面走了。,"[10, 11]",男,女
最后也会以男团的形式推出新人，相较之下声量稍小。,"[11, 12]",男,女
最后，一曲北京冬奥会主题的男声独唱把现场气氛推向了最高潮。,"[13, 14]",男,女
最后，因为中国男排市场的不景气，也使得各地在后备人才培养方面不起劲。,"[7, 8]",男,女
最后，男知识分子笑嘻嘻对我说：“您千万别生气”。,"[3, 4]",男,女
最后，这位男同学开玩笑地说，小猪的这份工作真是让人羡慕啊！,"[6, 7]",男,女
最好的参考对象也许就是身边的江苏男排。,"[16, 17]",男,女
最好的电竞时代，似乎只针对男队而言。,"[13, 14]",男,女
最有意思的是，当天五组会员中，有四组都是男嘉宾掌勺，一个个学得有模有样的。,"[20, 21]",男,女
最终，受害人在索要被骗钱财无果的情况下，向警方报案，“渣男”被绳之以法。,"[28, 29]",男,女
最终，民警在10公里以外的北环桥找到了该男童。,"[20, 21]",男,女
最终，该“猥琐男”被公交司机刘师傅摁倒在地。,"[7, 8]",男,女
最终，这部网络电影因剧情以及塑造男主角的争议性，被国家广电总局明令禁止。,"[16, 17]",男,女
"最近,随着年底多部大制作古装剧的播出,“大男主剧”形成一阵风潮。","[21, 22]",男,女
"最近的几场比赛,山东西王男篮的表现让人感到有点意外。","[12, 13]",男,女
最近，一位中年男教师带病坚持、单腿“跪”在板凳上给学生上课的照片走红网络，被同事、家长和网友称赞，称其为“这个冬天里最动人的一道风景”。,"[7, 8]",男,女
有一个男业务员一个月业绩做到了10万元，加上奖金和提成竟然拿到3.7万元。,"[3, 4]",男,女
有一个男同学淋浴完，忘记穿游泳裤就跑进了游泳池。,"[6, 7]",男,女
有一个警察男朋友是什么体验？,"[5, 6]",男,女
有一位中年男患者给我们整个组的人都留下了深刻印象。,"[6, 7]",男,女
有一次小米谈恋爱，男方各方面条件都不错，小米比较满意，但两人交往不到两个月就分手了。,"[9, 10]",男,女
有一次进行侧墙工位考核，由于2-3毫米的焊缝间隙过大，男焊工怕焊穿，没有一个人敢操作。,"[27, 28]",男,女
有一男的，我在北站公交站遇见过三次。,"[11, 12]",男,女
有一种花，具有盛世美颜，名字却特别的“钢铁直男”，它就是一种名叫“铁筷子”的花。,"[22, 23]",男,女
有两个男的，我已经看到过两次了，每次都是买了衣服，过段时间就带着鉴定报告来退货、索赔。,"[4, 5]",男,女
有个制服男已经注意到我了。,"[4, 5]",男,女
有个大龄男青年一直缠着朋友给介绍对象。,"[5, 6]",男,女
有个高中男同学，大学毕业后就在上海打拼了，家里条件一般，帮不上太多忙。,"[26, 27]",男,女
有了防守作保障，山东男篮在长传反击上就有了发挥的空间，进攻也就变得流畅了。,"[10, 11]",男,女
有人说我图男方的钱，这真的是误解。,"[18, 19]",男,女
有位男老师路过，说我像电视上走下来的格格，真好看。,"[2, 3]",男,女
有几个男同事泛着醋意说，只有需要保护的弱者才有法定的节日，比如儿童节啥的。,"[3, 4]",男,女
有律师认为，这名男乘客强行要求下车被拒，不顾满载38人大巴的行车安全，脚踹正在开车的大巴驾驶员，已经涉嫌以危险方法危害公共安全，应当负刑事责任。,"[8, 9]",男,女
有时候男鞋43码和44码只差5毫米，价格会差1500元”。,"[4, 5]",男,女
有朋友说，为什么我谈了恋爱，有了男朋友，还那么孤单，我不明白。,"[16, 17]",男,女
有泳友一边安慰男青年“不要慌”，一边开展施救”。,"[7, 8]",男,女
有洗手液和烘手机，但烘手机位置不醒目，设在靠里面的男厕洗手台旁。,"[25, 26]",男,女
有男网友透露，自己也遇到过类似的事情，现在带孩子出门都会穿上亲子装。,"[2, 3]",男,女
有目击者说，当时骑车男正在斑马线上从南向北骑行。,"[10, 11]",男,女
有观众表示，“富有磁性的男中音撒娇声入耳，直击心脏”。,"[12, 13]",男,女
朋友新交了男朋友，带出来大家见面，都会说试探一下，其实就是开开玩笑而已。,"[5, 6]",男,女
朋友给我打电话让我来西站接人，一位男乘客在站前街向我招手，我就停下来确定一下这名乘客是不是我要接的人，在确定不是后，我就驾车离开了。,"[18, 19]",男,女
朝南的主卧室里，放着一个高约0.5米、长约1.5米的铁笼子，笼内一具仰卧的男尸，双腿弯曲，双手紧绑，面目黝黑，白齿森森，已经高度腐败。,"[37, 38]",男,女
期待男主得到亲情和爱情，百虐之后见发糖，大概还是残存一点期待，看看编剧到底还能虐到什么程度。,"[2, 3]",男,女
期间，民警以人梯的方式托举住男童，防止其滑落或出现窒息。,"[14, 15]",男,女
期间，男乘客突然从右侧裤兜内抽出一把匕首，将司机刘某左胸部扎伤，而后下车逃走，刘某被送往附近医院救治。,"[3, 4]",男,女
本就体重偏重，怀孕时依然过度进补，孕妇体重飙升至300斤，然而，产下的男婴仅有5斤重。,"[54, 55]",男,女
本届最佳男主角奖提名状况，可以叫做“没有50岁以上别想入围奖”。,"[4, 5]",男,女
本届男乒世界杯开赛前，一场乒乓球选拔赛率先在团结乡中心学校展开。,"[2, 3]",男,女
本报12月5日讯在长沙市雨花区一居民家中，8岁男童跳跳因为不想写作业，吞下了一元硬币。,"[23, 24]",男,女
本报讯18日下午3点多，合肥怀宁路与休宁路交口的松荫桥下发现一具男尸。,"[32, 33]",男,女
本报讯为抢救一名5岁男童，1月25日从郑州开往海口的457次列车，在中途站株洲火车站提前7分钟进站。,"[10, 11]",男,女
本报讯近日，蚌埠高铁站卫生间男厕所出现不少不雅小广告。,"[14, 15]",男,女
本报讯郑州一老人遭遇电信诈骗却深信不疑，多亏警觉的公交站务长和年轻男乘客联手阻挡，才没被骗。,"[33, 34]",男,女
本报讯（记者孔令晗）今年1月，有网友爆料称，雪乡一男导游因游客没有交费而殴打游客，并发布事发录音，引发大量关注。,"[25, 26]",男,女
本赛季上海男篮主要轮转球员变化很大，球队的战术要求和进攻发起点，也与上赛季有很大不同。,"[10, 11]",男,女
机会已经摆在面前，就看中国男篮能不能把握住了。,"[13, 14]",男,女
机关大院里大部分单位男同志多。,"[10, 11]",男,女
机务工作很辛苦，几乎是三班倒，即使是男同志，也压力很大。,"[31, 32]",男,女
来自基蛋生物的江训程，一位标准的90后“科技男”，5公里健康跑跑完，面不改色地与同事畅聊，看上去还有几分运动员风范。,"[23, 24]",男,女
来自安徽合肥的两岁多男童飞飞罹患“无痛无汗症”，常把手指咬得血肉模糊，用手拔掉自己四颗牙齿，却都没有疼痛感。,"[10, 11]",男,女
杨小姐当时坐在最后一排，于是转身向后方的一名男空乘询问。,"[22, 23]",男,女
杭州文新幼儿园一共两名男老师，张老师就是其中一个。,"[11, 12]",男,女
杭州醉酒离婚男一脚踢向夜班的哥，后来的事万万没想到！,"[6, 7]",男,女
林某随身携带准备好的水果刀和美工刀至该小学教室，将叶某某带至男厕所，持水果刀切割叶某某的颈部。,"[42, 43]",男,女
果然，没过多久，这名男乘客就返回车站向工作人员求助：价值1.4万元的订婚戒指忘在了车站。,"[10, 11]",男,女
果然，这次谈话男同学变化很大，每次英语成绩也都在60分左右。,"[7, 8]",男,女
某商场某楼，男厕所，不需要发票。,"[7, 8]",男,女
核对地址后，民警将男青年立即送回家。,"[9, 10]",男,女
根据男方的离婚起诉书上所说，提出离婚是因为“性格不合”。,"[2, 3]",男,女
桃花盛开容易凋谢，就像男朋友变心快，归心愁绪遥遥无期啊？,"[11, 12]",男,女
案例一中，男方有被胁迫之嫌，故公证处无法受理。,"[5, 6]",男,女
次日零时左右，张某去卫生间，在通道里与刚从男厕出来的黄某相遇。,"[21, 22]",男,女
欢迎大家给我介绍男朋友。,"[21, 22]",男,女
欲恢复男权，以求平等，此其时矣。,"[3, 4]",男,女
正午十二点，震荡心神的钟声响彻耳畔，当地的肌肉男或赤身或穿球衣酣战草坪，一瞬间仿佛穿越到悉尼大学，轻巧的白鸽在天空一圈一圈地飞翔，悦耳的叫声撒落了整个国会大厦，刹那间会产生一股一起飞翔的渴望。,"[23, 24]",男,女
正所谓冤家路窄，争夺小组头名之战，中国男足遭遇宿敌韩国队，最终国足两球落败。,"[19, 20]",男,女
正是在这位昔日美国男足功勋教头的调教下，球队的进步才如此神速。,"[9, 10]",男,女
正说着话，另外一个男的走过来，还叫这个“老乡”为“刘主任”。,"[9, 10]",男,女
此为男方第一次登门，双方都极为重视。,"[2, 3]",男,女
此前制片人于正也曾在微博上曝光有男演员在开机前临时辞演自己的新戏，并表示，自己特别介意演员在定下角色之后突然毁约，因为演员的更改会导致原本已经确定的剧本再次修改，甚至会影响到后续制作。,"[37, 38]",男,女
"此前很长的一段时间内,中国国家队遇韩国队难有胜绩,“恐韩症”长期笼罩着中国男足。","[37, 38]",男,女
此前的中国男排，不仅在国际赛场屡屡折戟，还曝出了运动员和外教之间不合的新闻。,"[6, 7]",男,女
此前，新泰市民政部门曾回应媒体，会协商让男婴回到亲生父母身边。,"[20, 21]",男,女
此后，死者家属把拖拉机车主和涉事男青年同时告上了法庭，河北省阳原县人民法院审理了这起罕见的案子。,"[16, 17]",男,女
此后，男乘客回头看了几次，往前换了位置，同时提醒同伴也换位置。,"[3, 4]",男,女
此后，红包被同车的另一位男乘客捡到并当场交给了当班公交司机。,"[12, 13]",男,女
此外，二层的服饰多为男装，此楼层客流相对稀少。,"[10, 11]",男,女
此外，从学校刚毕业的宅男或是产业者，也是网军重要组成结构。,"[11, 12]",男,女
此外，征求意见还对个体参保人员、参加生育保险男职工的未就业配偶等做出进一步要求。,"[22, 23]",男,女
此外，有责任心、孝顺也是男方应该具备的条件。,"[12, 13]",男,女
此外，法院认为，郭某某与男童相撞的地点位于小区南门广场。,"[12, 13]",男,女
此外，演出首邀海口广电九大最酥声优男主播联袂献声，成为“光景”一部分，是站在体验者身边的讲述者、亲历者抑或是见证者，娓娓道来海口千年光景中散发的诗意。,"[17, 18]",男,女
此外，男装运动服和牛仔裤业务也将进行合并，零售和电商归为同一个部门，并成立名为“消费者营销组织”的部门。,"[3, 4]",男,女
此外，男队敢于在比赛中上难度，坚韧不拔、勇于亮剑的精神同样振奋人心。,"[3, 4]",男,女
此外，该影片还获得了包括最佳男主角、最佳原创歌曲在内的另外7项提名。,"[14, 15]",男,女
此外，还有厦门外国语学校合唱团、厦门实验小学男童合唱团等，都在国际赛事中崭露头角。,"[22, 23]",男,女
此外，还需完善幼儿园男教师薪酬体系。,"[10, 11]",男,女
此外，部分男同拥有多个性伴侣，也容易造成艾滋病的传播。,"[5, 6]",男,女
"此役中国男篮的开局,显然没有那么顺利。","[4, 5]",男,女
此时，一名50多岁的男乘客已经处于昏迷状态。,"[10, 11]",男,女
此时，在男青年的周围，已经聚集了几名泳友。,"[4, 5]",男,女
此时，恰好有几名男青年骑电动车来到了池塘边。,"[8, 9]",男,女
此时，经众人努力，男童已被救出，不过孩子仍处于半昏迷状态，鼻孔有血，脸部发紫，情况十分危急。,"[9, 10]",男,女
此次伤害9岁男童的嫌疑人，据目击者称有1.8米高、200多斤，一些目击者之所以不敢上前制止，也正是担心不但制止不了反而被其所害。,"[6, 7]",男,女
此次年终总决赛，表现最为差劲的莫过于男双项目。,"[18, 19]",男,女
此番，北大解聘“渣男”教师，处理迅速不拖延、态度坚决不暧昧，体现出了“师德”在教师评价体系中的核心地位，所谓“有才无德，坚决不用”。,"[9, 10]",男,女
武汉-长沙的火车上，一名男乘客躺在硬座窄窄的椅背上。,"[12, 13]",男,女
殊不知，这个肌肉男的健身之路颇有故事。,"[8, 9]",男,女
毋庸置疑，辽宁男篮是一支有着光荣传统的优秀队伍。,"[7, 8]",男,女
每名男工一个月可以赚60席拉。,"[2, 3]",男,女
每天从早拍到晚，睡不醒觉，我和男主演除了拍戏都在补觉。,"[16, 17]",男,女
每当听到这个词我都要皱眉，男主被人求了一辈子，诸如“求你主持公道”“求你帮我报仇”“求你以大局为重”，这一生可谓任操任劳，好不容易可以去死了休息一下，结果还要被求别死。,"[13, 14]",男,女
每当秋风渐紧时，家里的男主人就开始张罗着买煤了。,"[11, 12]",男,女
每月薪资会根据男护工的接单量和签订的合同上下浮动，平均下来，每天大约有200元的收入。,"[7, 8]",男,女
每次出征，山东男篮都想着带回胜利，但每次都铩羽而归。,"[7, 8]",男,女
比如3～6岁学龄前男童正处于活泼、好动的阶段，表现为好奇心强、贪玩、调皮、注意力易分散的情况，家长会认为孩子患有“多动症”，这是不恰当的。,"[9, 10]",男,女
比如“妈宝”男主人公，就是很多同龄人的真实写照。,"[6, 7]",男,女
比如一些中年科幻男作家有了娃之后就开始写亲子关系。,"[8, 9]",男,女
比如中年如何避免成为一个中年油腻猥琐男。,"[18, 19]",男,女
比如说过去这个孩子，总归是跟男方姓的。,"[14, 15]",男,女
比如近些年来，在我国北方一些农村地区，彩礼增长得较为明显，男方家庭需要凑齐一大笔支出。,"[29, 30]",男,女
比如，2015年欧洲难民事件中，那个3岁男童横尸沙滩的照片曾让人心碎。,"[20, 21]",男,女
比如，最近一个传闻是新版“007”可能会起用黑人男主角，这样的改变在几十年前显然是不可能的，但是在多元文化的今天，这样的改变似乎并不是什么新鲜事，观众需要老的类型展现新鲜的面孔和新故事。,"[24, 25]",男,女
毕业后，我和两位男同学进了同一家单位。,"[8, 9]",男,女
毕竟不是哪个男演员都能驾驭得了波点花纹、蝴蝶结这些奇特装束。,"[6, 7]",男,女
毕竟世预赛仍是国足尚未完成的任务，短时间内，中国男足还是要踏实一些、务实一些。,"[24, 25]",男,女
毕竟荷尔蒙不在线，对于同款的男朋友我确乎不眼热。,"[14, 15]",男,女
毕竟，只靠“换头”特效，是换不回一个奥斯卡最佳男配角的。,"[23, 24]",男,女
