句子,关键词位置,原始关键词,对立关键词
他敞开着一件皮夹克，肢体动作是“站有站相，坐有坐相”的反面，一看就是社会底层，甚至于就是这一带的混混，从不法交易中获利。,"[0, 1]",他,她
他文笔流畅，而且充满了独具魅力的幽默感。,"[0, 1]",他,她
他无法接受有人不爱吃涮羊肉，而爱吃方便面。,"[0, 1]",他,她
他既是技术专家又是经纪人，手里还有现成的树苗。,"[0, 1]",他,她
他早上4点半起床，到犬舍打扫卫生、带退役警犬散步，之后去单位上班，下班再去犬舍打理，一直忙到晚上才回家。,"[0, 1]",他,她
他早年失学，对有真才实学的同行们总是由衷地尊敬，并以博学为荣。,"[0, 1]",他,她
"他时常强调,你们不仅要学做买卖养家,还要学做人、学仁术。","[0, 1]",他,她
他明白每一笔按揭贷款后面，都承托着一个家庭所有美好的期盼，只有将工作做到一丝不苟才能将服务做到尽善尽美。,"[0, 1]",他,她
他是一个大诗人，但是一点儿架子都没有，非常平易近人。,"[0, 1]",他,她
他是一名从街道退休的志愿者，自发组建“社区巡访团”，专门巡查社区治理中存在的问题。,"[0, 1]",他,她
他是中国在线运行的铁路列车6次全面大提速的参与者和见证者，为中国铁路事业培养了一大批学术、学科青年带头人。,"[0, 1]",他,她
"他是买卖人,把俄罗斯的原材料如石油、木材、钢铁等转运到第三国,从中赚取差价。","[0, 1]",他,她
他是具备成长型人格的小人物，有一点稚嫩，还有一点自私。,"[1, 2]",他,她
他是才思敏捷的人，会瞬间想出很多办法，能凭借一张嘴把不同人的关系修复好，很阳光也很可爱。,"[1, 2]",他,她
他是文学战线上的一面旗帜，也是时代的歌者，站在陕北黄土高原，描绘祖国大好河山，抒发向善向上情怀，使读者产生强烈共鸣。,"[0, 1]",他,她
他是最耀眼的矛盾体：稳重老练又幼稚乖张，嘴硬嘲讽又温柔善良。,"[0, 1]",他,她
他是研究上海近代史的，却不知晓，于是开始研究。,"[0, 1]",他,她
他是网络正能量的传播者、主流价值的捍卫者、清朗空间的守护者。,"[0, 1]",他,她
他是聚训村人，每天7时多都会准时骑电瓶车到村委会打卡上班，然后带着一车工具赶到自己的包干区。,"[0, 1]",他,她
他是该窗口正式启用后，首位前来办理的外籍人士。,"[0, 1]",他,她
他是走出国门传授警务技能的“国际教官”，也是武艺高强却内心谦和的“良师益友”。,"[0, 1]",他,她
他是那样世界中的一个人，这样一条线索在现代中国的叙事中很大部分消失了。,"[0, 1]",他,她
他晒黑了，瘦了，但通过努力创建了全县首部户情民意档案，为新农村建设提供了详细的第一手资料。,"[0, 1]",他,她
他暗暗憋足劲儿苦练，终于在全团考核时，成绩达到了优秀。,"[0, 1]",他,她
他更加勤奋工作，将所有热情投入到团队建设中来，渐渐地各种奖励和荣誉也接踵而来。,"[0, 1]",他,她
他更有理由选择自己的生活，而不是为了别人的期望打球。,"[0, 1]",他,她
他曾七度卫冕大赛冠军，带领高球狂热，风靡一代又一代人。,"[0, 1]",他,她
他曾先后报考了在京的几个专业院校美术系，文化和专业课都通过了，但在面试时皆因肢体残疾原因功亏一篑。,"[0, 1]",他,她
他曾先后荣立个人三等功1次，受嘉奖1次，6次被评为县公安局先进个人。,"[0, 1]",他,她
他曾因为有几个孩子共同表达了想当魔术师的理想便决定开设魔术选修课，学校没有会教的老师就投入资金外聘。,"[0, 1]",他,她
他曾担任第九至十三届全国人大代表、全国人大常委会委员。,"[0, 1]",他,她
他曾是农民，干过河工，当过餐厅的经理，还干过电影放映员，从事了20多年记者和编辑工作，采访过的人至少得有两千人，听到了很多坐在办公室里听不到的俚语和俏皮话。,"[0, 1]",他,她
他曾经中风并患有高血糖、高脂血症等多种慢病，长期服用好几种药。,"[0, 1]",他,她
他曾经想写一本这样的专门谈艺术精神的小册子，但是只完成了三篇就不能写了。,"[0, 1]",他,她
他曾经说，自己在商务印书馆不仅学会了如何做事，而且学会了怎样做人。,"[0, 1]",他,她
他曾这样谈及自己与风云卫星结缘的经历。,"[0, 1]",他,她
他最喜欢画乡野间熟悉的风物，笔下各种动物和植物渐渐地惟妙惟肖。,"[0, 1]",他,她
他最大的心愿是能一直留在新疆的讲台上。,"[0, 1]",他,她
他最近一次出现在大众视野，还是2014年因为脑梗住院。,"[0, 1]",他,她
他有35年的厨师从业经历，目前从事烹饪教育工作。,"[0, 1]",他,她
他有些骄傲地表示，自己2004年看过一次升旗，9月份，早上温度还行。,"[0, 1]",他,她
他有再次引燃它的兴趣和热情，就用写作的笔触像根引信那样把一切点燃。,"[0, 1]",他,她
他有时早上来，有时下午来，时间也不一定。,"[0, 1]",他,她
他有独立的人格，又有着以自己创作所得的体会来理解我而准确表达的职业道德和职业水平。,"[0, 1]",他,她
他期盼一场场雪，在这个冬天，记录一个有童话味道的五大道。,"[0, 1]",他,她
他梦见一条巨蟒从天而降，先在宅堂里盘旋良久，随后跃入内庭环绕一番。,"[0, 1]",他,她
他欣慰，在这里孩子们练球积极性大大提高，在各项比赛中都取得了佳绩。,"[0, 1]",他,她
他正低头赶路，猛地被什么人从后面拽住了。,"[0, 1]",他,她
他正在用干劲、闯劲、钻劲，争做新时代最美奋斗者。,"[0, 1]",他,她
他此前曾在多个公开场合表示，小众书坊的小目标就是一天里到店的读者最好不要超过20个人，要做全北京最清静的书店。,"[0, 1]",他,她
他殷切的鼓励，让我对自己所从事的职业教育工作，感觉越来越有盼头，越来越有希望。,"[0, 1]",他,她
他每周都会带领团队进行业务学习及疑难病例讨论，努力提高科室专业技术水平。,"[0, 1]",他,她
他每天买菜，同菜场工作人员交朋友；散步时有意识地同别人交谈，了解社会民情民意，了解党的方针政策在老百姓中的反应。,"[0, 1]",他,她
他每天天不亮就到园子里，给苗木施肥、浇水。,"[0, 1]",他,她
他每天巡山，两次发现邻县山林失火，打电话告知相关部门。,"[0, 1]",他,她
他每天翻山越岭，眼中只有工作，那就是防止盗砍盗伐和山火。,"[0, 1]",他,她
他每天都要楼前楼后巡视好几圈，碰上问题能解决的当时就解决了，解决不了的就直接向社区反映。,"[0, 1]",他,她
他每次总帮我分析试卷上的问题，但我那时认为这不过是白费力气罢了。,"[0, 1]",他,她
他没有直接选择高学历才能胜任的技术岗，而是跑去分工厂的车间当一线技术人员。,"[0, 1]",他,她
他没有说，而是把这些留给读者去想，留给读者去填补。,"[0, 1]",他,她
他清楚地知道，自己想要成长，想要接触更多、学习更多。,"[0, 1]",他,她
他渐渐进入了状态，随着静下来的心气，原先都拿不稳针的粗糙的手开始自如地飞针走线，原先看不懂古代绘画的粗陋的眼睛开始能从画里读出意蕴。,"[0, 1]",他,她
他漫不经心地打开柜门，很随意地拿了一瓶酒。,"[1, 2]",他,她
他激动地说：“半岭有未来了，半岭的子孙后代有福了”！,"[0, 1]",他,她
他激情犹在，但对乐团的把控从容淡定。,"[0, 1]",他,她
"他热心公益慈善,捐资助学,扶贫济困,奉献社会,捐款额已达十七万余元。","[0, 1]",他,她
他热爱体育运动，经常抽空看足球比赛，比较热衷14场胜负彩，购买足球彩票之前也会认真仔细做“功课”，对五大联赛球队、欧冠、欧罗巴参赛球队信息都了如指掌。,"[0, 1]",他,她
他热爱公安事业，刻苦钻研业务，忠于职守，参与勘查现场2440余起，利用技术手段侦破各类刑事案件130余起，为打击刑事犯罪、维护社会治安作出了突出贡献。,"[0, 1]",他,她
他热爱家乡的山山水水，对名胜古迹题咏尤多。,"[0, 1]",他,她
他爱好广泛，不但喜欢旅游，还是北京钓鱼协会的裁判员。,"[0, 1]",他,她
他牵头成立了社区老干部议事协商会，通过共商共治、群策群力破解社区治理难题。,"[0, 1]",他,她
他犯下的其实是一个职场大忌：向领导展示自己的主观情绪而非解决问题的能力。,"[0, 1]",他,她
他狠抓保洁质量，实施定岗、定员、定质量，有效提高了城区卫生质量，为锦城环境卫生事业贡献了智慧和力量。,"[0, 1]",他,她
他现在不能大声或长时间说话，有时想大点声训孩子都会走音。,"[1, 2]",他,她
他现在最大的心愿，就是教出一批坚持艺术创作自由的优秀学生。,"[0, 1]",他,她
他珍惜白天的时光，到了晚年，更是刻意疏于交际。,"[0, 1]",他,她
他琢磨着明年开春再多上20个蜂箱，到时产量能多一倍。,"[0, 1]",他,她
他甘于奉献，不断加强学习，提高自身素质，履职尽责。,"[0, 1]",他,她
他甚至为了多参与几桩调解，将自己咽喉囊肿的手术一拖再拖：“我不知道，如果一场调解，别人去了，会不会失败；我只知道，如果我去了，有可能会成功，所以我要试一试”。,"[0, 1]",他,她
他生长在河北农村，父母都是农民，但本人却走出了北方的小村庄，朝着艺术工作者的方向一路飞奔。,"[0, 1]",他,她
他用力砸门、踹门几分钟，屋里也没人回应。,"[0, 1]",他,她
"他用十年的青春活力感染了无数患者,给单调乏味的康复之旅带去许多欢乐和希望。","[0, 1]",他,她
他用天津话与大家打招呼、介绍剧中角色。,"[0, 1]",他,她
他用妙笔创造出了一种具有时代气息的中国画山水新面貌，对当代中国画的发展做出了突出贡献。,"[0, 1]",他,她
他用平易的语言对我们讲音乐，讲作曲，顺手拣起一根柴棒来教我们怎样指挥歌咏队。,"[0, 1]",他,她
他用疲惫的声音告诉记者，大火已经完全扑灭，目前正在废墟中搜寻幸存者和遇难者遗体。,"[0, 1]",他,她
他用知识拓展、生命写作、师生情感互动等多种方式丰富语文教学的人文色彩，实现育人和教学的有效融合；在多所学校的语文教学中实施，统考、中考都位居全区前列，如今学校正将这套成熟理念贯彻到马山头学校初中部。,"[0, 1]",他,她
他用简单的造型和巨大的尺寸，营造出一种让人凝神的氛围，作品折射和营造的黑暗地带唤起了观众的神秘感受。,"[0, 1]",他,她
他用自己多年的技术经验帮助学徒们解决实际工作中遇到的问题。,"[0, 1]",他,她
他用自己的稿酬，长年累月搜集积累了一批极为珍贵而罕见的邮票，还有清代大龙邮票、小龙邮票和红花邮票等稀世珍品。,"[0, 1]",他,她
他用自己的镜头，记录见证了青头潜鸭由候鸟变成留鸟的一个历程。,"[0, 1]",他,她
他用镜头写给自然的这些情书，可能都会成为孤品。,"[0, 1]",他,她
他用镜头捕捉记录自然界生灵之瞬间美，用心体验一段经历，留下一份回忆。,"[0, 1]",他,她
他画的是梅花，先用赭墨画出苍劲有力的树干和枝叉，然后再勾勒九朵花，每朵花勾勒九个花瓣，整幅画面一共九九八十一个花瓣。,"[0, 1]",他,她
他画面中几乎只有黑白二色，以此传达：疏，清，幽，逸的格调。,"[0, 1]",他,她
他畅想着，如果一切都那么顺利，至少不会饿肚子。,"[0, 1]",他,她
他留下了严谨的治学态度、精益求精的工作作风、诲人不倦的育人精神和与时俱进的教育理念。,"[0, 1]",他,她
他留意到在校园里“宅”文化盛行，学生不爱劳动，没事就“宅”在寝室打游戏、玩手机，吃饭全靠外卖。,"[5, 6]",他,她
他白天藏在山洞，晚上住在树槐堂的小阁楼上，一边指导特委工作，一边养病，一边访贫问苦深入调查研究，关心群众生活，留下很多美谈佳话。,"[0, 1]",他,她
他的3个孩子都很懂事，为了不花父母一分钱，拼命学习，拿到奖学金，最后3个孩子都读到了博士。,"[0, 1]",他,她
"他的一名同事曾经接诊过一名被狗咬伤的患者,这名患者从狂犬病发病到死亡只有短短的7天。","[0, 1]",他,她
他的一生，可以说是到处钻营、反复无常，甚至不惜牺牲民族与国家利益。,"[0, 1]",他,她
他的一生，是革命的一生、奉献的一生，是为党和人民事业奋斗的一生。,"[0, 1]",他,她
他的一生，都在致力于毛泽东思想研究，矢志不渝。,"[0, 1]",他,她
他的严格和风趣总是能把我们逗笑，轻松愉快又不乏认真地上好每一节科学课。,"[0, 1]",他,她
他的个展除了普通的展示意义之外，更推崇人与人之间的感应与互动。,"[0, 1]",他,她
他的乳名‘馍头’，在老一辈的开封人里可以说是众所周知。,"[0, 1]",他,她
他的事迹，至今仍是为官清廉的好教材。,"[0, 1]",他,她
他的人生足迹，放射出耀眼的光芒，让我们景仰、追寻。,"[0, 1]",他,她
他的作品以表现民族发展史中的典型人物，民族文化史中的代表人物，时代发展中的道德模范、劳动者代表和祖国优美壮丽的河山为主要内容。,"[0, 1]",他,她
他的作品至今仍然跟我们的社会有千丝万缕的关联，仍然会带出很多重要的问题，这些问题仍然值得我们思考，这也是路遥不朽的魅力之一。,"[0, 1]",他,她
他的作品饱含诗情画意，激荡着爱国情怀，让人赞叹不已，是美轮美奂的艺术珍品。,"[1, 2]",他,她
他的作品，充满了艺术才气和都市情调，人物造型准确、生动、细腻。,"[0, 1]",他,她
他的作品，必须要有自己独特的声音，除了个人感情的抒发，还要对自己所处的环境和周围的人有一种仁慈的关怀。,"[0, 1]",他,她
他的内心逐渐厌恶起重庆，逃出这座城市的想法愈发强烈。,"[0, 1]",他,她
他的创作涉及插画、海报、绘画、剧院设计、珠宝设计、装饰艺术等诸多领域，既有鲜明的新艺术运动特征，又带有强烈的个人色彩。,"[0, 1]",他,她
他的发言完毕，台下掌声一片，有人悄悄地抹起了眼泪。,"[0, 1]",他,她
他的各类仿生茶具趣味盎然，又开创了壶体镌刻诗铭之风，是否丰富了紫砂的文化内涵，扩展了茶具雅玩的品种？,"[0, 1]",他,她
他的名下不仅有粤海关授权经营外贸的义成行，还有纶聚号等多个商号，俨然一家进出口集团公司。,"[0, 1]",他,她
他的周围是铺天盖地的烈焰，那是无数红烛燎起的熊熊火焰，在暗红色的背景中，白色的火苗熠熠跳动。,"[0, 1]",他,她
他的回答简单有力：这里的老百姓需要有人守护。,"[0, 1]",他,她
他的团队有十几个人，除了接居民家的活儿，还接公司的活儿，基本上没有淡季，只是年底活儿更多一些，有提前一周预约的，也有提前一个月预定的。,"[0, 1]",他,她
他的声望，不是靠庙堂的封赏，而是靠自己的著述、自身的文化积累和持续的公共关怀。,"[0, 1]",他,她
他的声调骤然升高，声音也大了起来，如即将喷发的火山，在抑制着自己的怒火。,"[1, 2]",他,她
他的声音还是很小，说还有事情没有办完，让我开进小区。,"[1, 2]",他,她
他的好朋友小张给老板开小车，既体面又风光。,"[0, 1]",他,她
他的子孙们靠着分得的家产，开始过上了衣食无大忧的温饱生活，仅靠出租土地就能维持生计。,"[0, 1]",他,她
他的孩子练习萨克斯管，不开车非常不方便。,"[0, 1]",他,她
他的客户包括视频游戏迷、电影迷和想要好身材的普通人。,"[0, 1]",他,她
他的家乡在大山中，只有几户人家，大家生活都相对困难。,"[0, 1]",他,她
他的小学时光过得很轻松，没有经历过辅导班的狂轰滥炸，有限的一两个兴趣班都是子墨自己主动要学的。,"[0, 1]",他,她
他的小说大都是以杂志连载形式发表的，由于经济压力写了几章就得赶紧出去。,"[0, 1]",他,她
他的工作是给制造业装上“工业大脑”，以大数据算法模型指导生产，每年能为这个车间节省几百万元。,"[0, 1]",他,她
"他的强硬作风很快得到了村民的肯定,多年的垃圾堆终于清掉了。","[1, 2]",他,她
他的徒弟沈一众说，就是一个垫片没放正，师傅也会把螺丝松开，放正后重新拧回去。,"[0, 1]",他,她
他的态度势必会影响到粉丝的态度，以更理性更正确的方式来表达对偶像的热爱，这对整个社会都是有正面的积极引导作用的，这也才是职业演员和公众人物最应该做的事情。,"[0, 1]",他,她
"他的思路一般人跟不上,我们都自叹不如。","[0, 1]",他,她
他的所有文字都带着痛感，那些与百姓息息相关的咏叹，才是其生命哲学最为动人的部分。,"[0, 1]",他,她
他的手法很融合，很多变，有时候，你甚至能惊讶地听出一点爵士的味道。,"[0, 1]",他,她
他的指哨还是一如既往的嘹亮高亢，仿佛带领观众穿越到千年前豪气干云的群雄时代。,"[0, 1]",他,她
他的摄影作品富生活化、民俗化和时代气息，并延续了鲁艺的传承精神，做人民的艺术家，时刻关注人民群众的物质和精神文化生活，敏锐地捕捉时代的巨大变迁。,"[0, 1]",他,她
他的摄影大气、细腻，有油画的肆意，更有国画的写意，可见出鲜明的个人特色。,"[0, 1]",他,她
他的摄影涵盖日常文化、大众心态及社会思想，尤其注重百姓的生活起居及心灵关怀。,"[0, 1]",他,她
他的文章有个人主义的背影，也有世界主义的气味，这些并没有成为空洞的说教，而是化为了中国人特有的问题意识。,"[0, 1]",他,她
他的歌声是如此浑厚、说话是如此幽默，常常勾出顾客唇边一串串愉悦的笑声。,"[0, 1]",他,她
他的水稻种植，有一套完整的科学管理体系。,"[0, 1]",他,她
"他的演出中有许多让古典音乐炫酷起来的尝试,让人印象深刻。","[0, 1]",他,她
他的演唱充满激情，善于以情感人，能够把握各类歌曲的演唱风格。,"[0, 1]",他,她
他的演讲只有五六分钟，现场听众不多，坐着些媒体人。,"[0, 1]",他,她
他的灵魂也在艰苦磨难和牧民的温暖中更新，渐渐认同劳动者身份，灵魂得到洗涤，精神有了升华。,"[0, 1]",他,她
他的照片看上去更艺术，每张都好像是电影里的一帧。,"[0, 1]",他,她
他的父母好几次在工作站里抱头痛哭。,"[0, 1]",他,她
他的特点就是速度，打出的球也有威胁，今天也没有什么失误，而我打得就不是特别舒服。,"[0, 1]",他,她
他的生活依然简朴低调，有时候吃完饭，用开水冲一碗菜汤便是美味佳肴。,"[0, 1]",他,她
他的画本随身携带，碰到什么好看的写生对象，临时就能画。,"[0, 1]",他,她
他的短暂一生，浓缩了太多的悲情世事，该经历的都经历了，不该经历的也经历了。,"[0, 1]",他,她
"他的研究回归哲学的人文传统和批判传统,在学院化的哲学研究之外,独辟哲学写作新境界,在数字媒体时代照察社会情况和人类心灵。","[0, 1]",他,她
他的研究还为精神分裂症和帕金森氏症治疗药物的研发奠定了药理基础。,"[0, 1]",他,她
他的精神会一直鼓舞我努力去做好一个学生的好老师。,"[0, 1]",他,她
他的纷纭的思绪迅速地凝聚起来，变成深刻的人生体悟。,"[0, 1]",他,她
他的经营范围既有输出生丝、茶叶、木材等原料品，也有输入糖、烟、酒、五金、百货等生活物资。,"[0, 1]",他,她
"他的英雄壮举,在浙江、山东乃至全国引起强烈反响。","[0, 1]",他,她
他的言传身教，让团里的年轻演员们获益良多，也深受鼓励。,"[0, 1]",他,她
他的讲解内容丰富、见解独到，给同学们留下了深刻的印象。,"[0, 1]",他,她
他的诗作有的慷慨沉雄，大气磅礴；有的幽绪高致，婉约清丽；可说诸体兼备，异彩纷呈。,"[0, 1]",他,她
他的诗在内容上的突出特点，就是具有极强烈的民族意识和民族气质，表现出深沉、热烈的爱国主义精神，并从爱国爱民的真情出发，表现出对黑暗现实的厌恶，对人民疾苦的同情和美好未来的憧憬。,"[0, 1]",他,她
他的话也警醒了我，对别人的盲目鼓励其实是不负责任的，也是一种懒惰行为。,"[0, 1]",他,她
他的话让我很感动，因为我们人生的三分之二都是在北京人艺度过的，人艺就是我们的家，这是家里的事情，这份感情是我最大的动力。,"[0, 1]",他,她
他的质朴与担当，展现了劳动者最美的一面。,"[0, 1]",他,她
他的赤诚坦荡得到了友人们的认可，从而收获了大量的信任和支持；而这些在波折命运中相互扶持的温暖故事，也成为文学史上被众人传诵的佳话。,"[0, 1]",他,她
他的这些思考，非常有现实的针对性，思想意义就会特别突出。,"[0, 1]",他,她
他的选择源自对自己能力和扬州工业职业技术学院就业创业教育的信心，“学校贯穿3年的就业创业教育，让我对职业生涯有了明确规划”。,"[0, 1]",他,她
他的闪烁登场，不仅标志着现代高尔夫球新时代的降临，更扩大了这项运动在全球范围的影响。,"[0, 1]",他,她
他目前致力于发展城市文旅的投资与顾问，吃喝玩似乎要成为主业。,"[0, 1]",他,她
他直言，国际社会失去了应对气候危机的一个重要契机，但“我们不应放弃，我也不会放弃”。,"[0, 1]",他,她
他直言，每一条道路的贯通，每一处矛盾的化解，无不体现全县广大干部敢于直面困难，勇于迎接挑战的拼闯精神。,"[0, 1]",他,她
他相中了这块风水宝地，便在此建房安居，并取名五龙村。,"[0, 1]",他,她
他相信人工智能将对国防和经济产生影响，称其为“最重要的领域之一”，表示已在这一领域设立国家项目。,"[0, 1]",他,她
他看了加州理工学院给我奖学金的通知书后，便答应由北大为我申请办理出国手续。,"[0, 1]",他,她
"他看到一些东西就想拆开看看里面的原理,很努力上进,不是那种拖拖拉拉偷懒的孩子,平时做一些电子类产品,都很积极地去参与。","[1, 2]",他,她
"他看好这一轮医药创新周期来临带来的投资机会,这是一个会持续3-5年时间的投资周期。","[0, 1]",他,她
他看我一眼，远望有点悻然，骑车离去。,"[0, 1]",他,她
他真是洋相百出，在友谊和爱情两个领域都难有建树。,"[0, 1]",他,她
"他真的因为阅读而变得更加强大,而丝毫不会因此而削弱了自己。","[0, 1]",他,她
他真的很喜欢打篮球，很感谢有这样一个平台让孩子能接触到专业的篮球训练。,"[1, 2]",他,她
他眼瞅着厂房一点点建起来，一直在工厂里呆了20年。,"[1, 2]",他,她
他眼角泛着泪光，将目光投向远处的起火大楼，期待更多人能被救出。,"[0, 1]",他,她
他睁大眼睛说不可思议时，表情轻松，但其实泡在冰融水里的脚已经冻麻木了。,"[0, 1]",他,她
他睁大着眼睛，直楞楞地看着天花板，微张着嘴，呼哧呼哧地吐气，仿佛喉咙上布满荆棘，每一缕气都被划拉得拖丝带缕的。,"[0, 1]",他,她
他知道，要想当上党支部书记、村主任一类的村主管，必须是村中公认的“能人”，说白了就是要具备一个特征，“有钱”。,"[0, 1]",他,她
他确实是非常苦的一个人，整整十年都浪费了。,"[0, 1]",他,她
他示意大家跟随着音乐的强弱与快慢来鼓掌，全场的气氛瞬间达到了高潮。,"[0, 1]",他,她
他种植的苗木不仅在本省销售，还销往江苏、安徽、湖北等省份。,"[0, 1]",他,她
他积极走在用音乐、艺术、集会来维护环境、反核的一线阵地，这依然是一个人进入自然之子状态后必然采取的行动。,"[0, 1]",他,她
他稍稍感到一点不公，但很快就释然了。,"[0, 1]",他,她
他究竟拿出多少钱捐助别人，根本无法统计。,"[0, 1]",他,她
他穷尽一生收藏图书，编纂多种书目，撰写出版专著，对我国文学史料的研究作出了突出贡献。,"[0, 1]",他,她
他穿上工作服，挂好胸牌，整理好仪容，大步流星地走出宿舍。,"[0, 1]",他,她
他穿了一身有蓝白格子线条相间的囚服，理了个平头，干净而清爽。,"[0, 1]",他,她
"他穿着板板正正的毛衣,外面套了个羽绒坎肩。","[0, 1]",他,她
他突然掐我的脖子，打我的头和脸，我赶紧把车停在路边，结果那个乘客下了车，用钥匙在车后门划了两道口子。,"[1, 2]",他,她
"他立刻调整好心态,下决心聘请了种植专家,并在种植基地旁的小屋住下,这一住就是两个半月。","[0, 1]",他,她
