句子,关键词位置,原始关键词,对立关键词
"但她每天早晨4点半就起床,送孙子去上学,去课堂里上课,下午再把孙子接回来。","[1, 2]",她,他
"但她认为,只要发自内心地表达自己,创作出感动观众的作品,就是艺术家价值的最好体现。","[1, 2]",她,他
"但她认真做事的时候,那坚定的眼神,那严肃的表情,那麻利的动作,会让我肃然起敬,同时,还会让我感受到一种不同寻常的“美”。","[1, 2]",她,他
"但她是否更换姓名、在阿克苏具体做什么,都不清楚。","[1, 2]",她,他
但她所拍摄、传播的视频也引起巨大争议：这是真实生活吗？,"[1, 2]",她,他
"但她突然发现童年少年生活过的屋子正在消失和倾颓,长辈相继去世,带走了老屋中的大部分。","[1, 2]",她,他
"但她喜欢自习室里透出的那种大城市的“冰冷感”：没人跟你打招呼寒暄,没人关心你要干什么,大家目的都很明确,各自埋头做自己的事。","[2, 3]",她,他
"但她也表达了自己的小小愿望：“希望孩子们穿上我们织的衣服,就不用再受冻了”。","[1, 2]",她,他
"但她也说：“我喜欢多元之美,自然之美,没有刻意要模仿任何人,没有特别的书写策略,也没有想要卖弄文字技巧”。","[2, 3]",她,他
"但她印象中的体育彩票并非体育彩票的全貌,体育彩票的很多方面还没有被大家所了解。","[1, 2]",她,他
"但她有自己的讲究,“表面工夫”必不可少：视频光线要充足,演奏者必须注重自己的仪容,让观众看得舒服。","[1, 2]",她,他
"但她在家人和朋友的鼓励下,重拾自己的坚强与乐观,勇敢地面对病魔,战胜了心魔。","[1, 2]",她,他
"但她知道,唯有行动能够打破僵局,令牺牲不被白费。","[1, 2]",她,他
"但她只休息了一夜后,第二天就匆匆忙忙赶赴江苏省职业院校技能大赛现场,令同事和学生十分感动。","[1, 2]",她,他
"但她昨晚现身赛场并积极参与热身,打破了外界的不实传言。","[1, 2]",她,他
"但现在,她再也不发愁了。","[4, 5]",她,他
"但因为伤情需要,她必须接受手术治疗,于是患者在家属的陪同下来到了长春市传染病医院。","[8, 9]",她,他
"但由于工作繁忙,她没有多余的时间领取爱心毛线,以及跟随我们邀请的编织老师一起学习如何编织。","[8, 9]",她,他
但这个直播间好像给她的生命带来了新的意义。,"[9, 10]",她,他
"但这其实无伤大雅,而且恰恰是她受欢迎的关键。","[14, 15]",她,他
"但这些年来,她一直过得非常好,充满正能量。","[6, 7]",她,他
"但至今,她看到儿童游乐场内,孩子在地垫上爬来爬去或抓咬一些小玩具,心里仍觉得非常不舒服。","[4, 5]",她,他
"当初她在乌克兰局势不稳、前景不明的情况下参与签署停火协议,无异于拿自己的声誉冒险。","[2, 3]",她,他
"当地70多岁、双目失明5年多的老人阿布,一直有个心愿,就是希望能再看一眼她的子孙。","[36, 37]",她,他
"当记者问起是否了解重新装修开业需要进行消防审验等相关手续时,她没有正面回答。","[30, 31]",她,他
"当年,也是一位记者在采访她时,提起了一个6岁的小姑娘家庭困难,正面临辍学。","[12, 13]",她,他
"当年5月,出发前往美国前,她来到海南岛游玩。","[13, 14]",她,他
"当年9月,她因大腿根部疼痛去医院就诊,被诊断为强直性脊柱炎。","[5, 6]",她,他
"当年她读的是北京对外经济贸易大学,毕业后还做过几年朝九晚五的白领。","[2, 3]",她,他
"当年她高考志向是湖南大学,结果阴差阳错,最后被调剂到中南林业科技大学。","[2, 3]",她,他
"当疲惫的她从产房被推出来时,被眼前的一幕惊呆了。","[4, 5]",她,他
"当然也是因为她说了那些话,才会给人留下截图。","[6, 7]",她,他
"当时,笔者正处于忙碌阶段,不想随便请假,就打了电话给朋友,试图请她过来与医生沟通,取消住院的决定。","[32, 33]",她,他
"当时,还有一位领舞的马老师,她也力邀我加入。","[15, 16]",她,他
"当时,买一部智能手机要3000多元,为方便孩子学习,我就咬咬牙给她买了一部。","[32, 33]",她,他
"当时,她骑着高头大马,身挎双枪,真是英姿飒爽。","[3, 4]",她,他
"当时,她所乘坐的车辆径直撞上拐弯处路边的防护墙。","[3, 4]",她,他
"当时,在厦门一家嫁接苗企业担任高管的她,放弃了企业的高薪和舒适的生活环境,带着奋斗多年的积蓄,毅然回到贵州,成立了遵义劳仑丰农业科技有限公司,开启了返乡创业之路。","[18, 19]",她,他
"当时,自治区公路管理局面向社会公开招聘考试,她毅然报考了崇左市大新县公路管理局,以笔试、面试均第一名的成绩顺利入选。","[22, 23]",她,他
"当时的她还不知道,几年后的今天,自己有一天能有机会投身于这片热土。","[3, 4]",她,他
"当时是寒冬腊月,订单又要得急,她和工人们不分昼夜地赶工,终于圆满地完成了订单,收获了创业路上的第一桶金。","[15, 16]",她,他
"当时她很虚弱,眼睛也无神,我好像看到了曾经的自己。","[3, 4]",她,他
"当时她家住通州,孩子在丰台治疗,来回要五个小时车程。","[2, 3]",她,他
"当时她觉得钱副教授急着回家,于是就上了车。","[2, 3]",她,他
"当时她躺在雪地上,大脑一片茫然,而那个少年却什么话也没说,赶紧起身逃走了。","[2, 3]",她,他
"当时她只有二十来岁,全家以操船贩盐为业。","[2, 3]",她,他
"当时她住在深圳,为了和全国拉丁舞冠军学习,每周末都会跑去广州上两小时课再回来,从来没有抱怨过。","[2, 3]",她,他
"当时我就问她,为什么不高兴？","[6, 7]",她,他
"当时演新戏不如演旧戏上座率高,影响票房收入,她却义无反顾地坚持下来。","[22, 23]",她,他
"当时一家中介公司把她带到了售楼处,后续都是由置业顾问对接。","[9, 10]",她,他
"当时已是年过半百的她,带领敦煌研究院的成员们为每个洞窟、每幅壁画和每尊塑像建立数字档案。","[9, 10]",她,他
"当时因朋友催促乘车离开,她只顾上和交警说了“谢谢”。","[12, 13]",她,他
"当时这位顾客是拿了一些旧的黄金来换货品,在换的过程中我们都给她讲得挺明白的,顾客也是自主选择,我们没有强买强卖。","[31, 32]",她,他
"当事班级班主任邓老师说,12月23日下午,她课前点名发现有孩子没来上课,联系家长得知,其中两名孩子经医院检查已患上水痘。","[21, 22]",她,他
"当收到青海民族大学录取通知书时,她既兴奋又有些不安。","[16, 17]",她,他
"当她爬上冰面做两个俯卧撑后,又开始单腿站立表演一套瑜伽动作。","[1, 2]",她,他
"当天售卖的都是她自己手工制作的一些配饰,有耳环、发簪、项链等。","[7, 8]",她,他
"当天她来招聘现场,想通过自己的努力自食其力。","[2, 3]",她,他
"当天她推着一个小型手推车,准备购买各类特产。","[2, 3]",她,他
"当天晚上,终于把工作做完,可是重压之下的她,却像失重的陀螺,突然失去方向。","[20, 21]",她,他
"当晚7时12分,她给小柯发了多条信息,但一直没收到回复。","[8, 9]",她,他
"当晚我是在报社食堂吃的晚饭,我把她做的红烧肉和同事们一起分享,大家都说做得很好吃。","[16, 17]",她,他
"当我帮她试穿新衣服时,小脸上现出笑容是我最大的欣慰。","[3, 4]",她,他
"当我看到优美的学习环境、可口的饭菜,听到她高兴地讲起学习生活的情况时,我放心了。","[20, 21]",她,他
"当我玩得得意时,曾无数次突然看到她在岸上树下的影子。","[16, 17]",她,他
"当小区被选定为垃圾分类试点小区时,社区主任第一时间找到了何芝骅,看中的正是她的经验和特长。","[37, 38]",她,他
"党的十九大召开后,她被选为少数民族学生代表参加“校长有约”,交流学习十九大报告的心得。","[9, 10]",她,他
"到了晚上,爱人上网查了一下如何饲养鹦鹉的知识,她一一对照学习。","[23, 24]",她,他
"到了夏季,她还要对公厕定期消杀,保持无蝇虫。","[5, 6]",她,他
"到站后,当我起身奋力挤向门口时,她用手为我在人群里推开一些空当。","[16, 17]",她,他
"到这岁数了还麻烦到自己当年的老师让我万分惭愧,我能为她做点什么呢？","[26, 27]",她,他
"得病后虽几次去长春治疗,但最终也没能留住她。","[20, 21]",她,他
"得不到家庭温暖的她,很早辍学混迹社会,走上违法犯罪道路。","[8, 9]",她,他
"得知“家之味”公益餐厅后,她主动把价值三四万元的厨具捐献出来,随之也成为这个“大家庭”中的一员。","[13, 14]",她,他
"得知发车日期和时间都还未确定后,她决定自行买票回家。","[16, 17]",她,他
"等到封江后,她也能跟随老队员在冰水中畅游。","[6, 7]",她,他
"等到她真的认不出我们了,可能谁照料都一样,再考虑去养老院。","[2, 3]",她,他
"等到醒来后,她发现电话竟然还没有挂断,于是迷迷糊糊说了声“哈喽”,而对方在电话那头回了一句,“我在这里”。","[6, 7]",她,他
"等护工回来,老刘正准备对她发火,护工主动认错道歉,还请求扣自己工资。","[12, 13]",她,他
"等她长大,从父母家住出来,又选择了老房子的附近住――虽然家已经没有了,弄堂也没有了,可还是想住在那里附近。","[1, 2]",她,他
"等她出去后,钱副教授又告知时间太晚了,把车开过来,在车上继续说吧。","[1, 2]",她,他
"等她大一点,找到自己的兴趣点时,家长辛苦点接送也值得。","[1, 2]",她,他
"敌人把她全身上下搜了个遍,还把篮子里的东西全都倒了出来,仍一无所获,只好悻悻地走了。","[3, 4]",她,他
"第一晚的音乐会中,她不再是往昔那位以我行我素著称的钢琴大师,更像是一位可亲,还有些可爱的长者。","[9, 10]",她,他
"电厂的职工大都上倒班,黑白颠倒,她每回到了厂里干什么都轻手轻脚,生怕吵着了人。","[16, 17]",她,他
"电子台账4.0版上线后,社工小周发现自己有了“72变”的本领,作为文体条线干部的她,现在应对居民前来咨询的就业援助、低保申请等政策也能“门清”。","[40, 41]",她,他
"店子位置偏远,钱不好赚,她想换个地方再开店试试看。","[12, 13]",她,他
"顶着压力,她奋发自学,毅然重新参加高考,报考中医专业,并再次顺利走进大学校园。","[5, 6]",她,他
"丢了钱能还给人家,这种拾金不昧的精神,值得我们全体村民向她学习。","[29, 30]",她,他
"冬季,要察看老人是否盖好被子；雨天地面湿滑,她吩咐老人走路要小心。","[22, 23]",她,他
"冬天闲暇的时候,她会拿一个罐头盒,在里面放把米,掺点水,搁在砖头垒的炉壁上,说是给我们做米饭吃。","[8, 9]",她,他
冬泳这项运动她会一直坚持下去。,"[6, 7]",她,他
"都说陪伴是最长情的告白,那让你爱的那个她“从未长大”,应该是一种最长情的陪伴了。","[19, 20]",她,他
"短短的一年多时间,她已经在3个直播平台上亮相,至少挣了十几万元。","[10, 11]",她,他
"短短一年多时间里,她在3个直播平台上亮相,至少挣了十几万元。","[10, 11]",她,他
"短短一堂课,她从一条微信入手探讨国家安全,从一桶油入手分析国家安全,充分调动孩子们的积极性和主动性,也将“守卫国家安全从我做起”的种子埋入孩子的心田。","[6, 7]",她,他
"兑完奖后,大奖得主表示她将一如既往地购买体彩大乐透,为公益事业继续献爱心。","[11, 12]",她,他
"队长是一队之长,她的实力与临场表现在很大程度上决定着一支球队的走向。","[8, 9]",她,他
"队员入户探访推开老人家门时,她正卧病在床。","[14, 15]",她,他
"对此,有着十几年网购经验的她抱怨道：“作为一个网店居然一周双休、朝九晚五,那和实体店还有什么区别”？","[13, 14]",她,他
"对此她表示自己并不知道事情的严重性,并表示以后不会再犯。","[2, 3]",她,他
"对待工作热情周到,在平时的生活中她也是个热心肠。","[16, 17]",她,他
"对汉服的喜爱改变了她的成长路径,也将改变越来越多人对于传统文化的看法。","[9, 10]",她,他
"对家门口这个智能化、多功能的运动场所,她用四个字总结：非常满意！","[19, 20]",她,他
"对那些捕风捉影的非议,她从没有想过去争论,更不会为自己辩护。","[11, 12]",她,他
"对筛选出的千余条疑点数据,她加班加点逐户分析逐户定性问题,不再下发基层税务机关逐级上报,而是第一时间通知纳税人,确保减税降费政策落地生根。","[13, 14]",她,他
"对她而言,发现自己的问题是十分困难的。","[1, 2]",她,他
"对她来说,把人社领域办事“一次都不用跑”做好,是孜孜追求的目标。","[1, 2]",她,他
"对她来说,今年的松溪县第三届旅游发展产业大会,自己不仅是围观者,更是个参与者。","[1, 2]",她,他
"对文字敬畏并考究,让她渐入佳境。","[10, 11]",她,他
"对现实的反思,对人类命运的关注,以及对词语的迷恋,这是她的诗歌一以贯之的特征。","[27, 28]",她,他
"对艺术家而言,这未必是自觉的选择,但她的用心是疏朗有致、自成气象,所以就自然而然有了这些气口,它们灵动,又逻辑关系严密。","[18, 19]",她,他
"对于“70后”的她来说,新华书店是记忆里永恒的“精神家园”。","[8, 9]",她,他
"对于此次参加主持人大赛,她谦逊地表示要“向师哥师姐们学习。”","[12, 13]",她,他
"对于该公司的虚假宣传事件,她认为系“同行打击”。","[13, 14]",她,他
"对于乐同学的成长,她的家长在学业发展、人格修养、家国情怀的塑造上,都起了决定性因素。","[9, 10]",她,他
"对于每一位来访者,她都会用最大的热情和耐心给予抚慰。","[9, 10]",她,他
"对于那时候的她来说,并不知道什么是“民族文化”,更不知道作为土生土长的彝家妹子,怎么将彝族刺绣技艺保护和传承下去。","[6, 7]",她,他
"对于社区工作的年轻人,她特别重视培养,很有耐心。","[11, 12]",她,他
"对于她个人而言,这本书既是倾诉,也是对自己、对生活的审视。","[3, 4]",她,他
"对于像她这样的认知症患者而言,面临的现实问题是记忆力衰退、行动迟缓。","[3, 4]",她,他
"对于在欣嘉园购置房子,她说：“周边配套的幼儿园和小学都是我急需的”。","[11, 12]",她,他
"顿顿外卖,喜欢宵夜,她突发重症胰腺炎进入,抽出来的血全是黄色油脂！","[11, 12]",她,他
"多年来,她带领广西万科营销团队不断征战,业绩屡创新高。","[4, 5]",她,他
"多年来,她克服“上有老下有小”需要照顾的实际困难,挤出时间也要参与公益活动,服务社区、服务邻里,在一点一滴的小事中传播正能量,用实际行动践行一名党员的初心和使命。","[4, 5]",她,他
"多年来,她率先运用公开听证化解社会矛盾,创新推出“一上门、两张卡、三公开、四告知”等便民机制。","[4, 5]",她,他
"多年来,她深耕神经病学研究,推动国际交流,为学科发展和人才培养做出了突出贡献。","[4, 5]",她,他
"多年来,她始终坚守着服务居民群众的初心,在平凡的岗位上默默奉献。","[4, 5]",她,他
"多年来,她一直患有严重的高血压,需要长期服用降压药。","[4, 5]",她,他
"多年来,她有力化解了大量拆迁纠纷、物业纠纷,为辖区社会稳定作出了积极贡献。","[4, 5]",她,他
"多年来她一直保持同一形象：一条黑色的大麻花辫,一身素色,气质沉静,在光鲜亮丽的时尚圈中显得如此另类,甚至有些格格不入。","[3, 4]",她,他
"厄运与她绕肩而过,或许是老天不忍看到这部作品永远成为遗憾。","[3, 4]",她,他
"而不普通的是,当很多人对“班主任”这个学校里职务最小责任最大的“主任”,有点敬而远之百般推辞的时候,她毫不避让,而且激动欢喜,“需要我当我就当”。","[50, 51]",她,他
"而跟她同样大的孩子们,都还徜徉在知识的海洋里,享受着学习的快乐。","[2, 3]",她,他
"而后,因为害怕再次被“困”,她和家人从下午开始就没再关过门。","[14, 15]",她,他
"而今桃李遍天下,她依旧没有停下传播广东汉剧的脚步。","[8, 9]",她,他
"而就在不久前,她带领全所民警圆满完成第二届中国国际进口博览会安保任务,又一次交出了“零失误”“零差错”的完美答卷。","[7, 8]",她,他
"而且对于过年期间工资更高的标准,她表示理解,毕竟在年末离家工作也很不容易。","[17, 18]",她,他
"而实际上她得了一种罕见的脑癌,目前无法治愈。","[4, 5]",她,他
"而她不在场上,我除了要做好自己,也要去提醒队友们出现的问题。","[1, 2]",她,他
"而她的天台,是水灵灵的鸡毛菜带来的,对一张晚餐方桌的联想,是与这个城市更多的体己。","[1, 2]",她,他
"而她对于新诗的发展,又能探幽发微,知人论世。","[1, 2]",她,他
"而她更惊讶的是,这个没有校园和校舍的学校,却管起了整个长沙所有的工厂、矿山、学校、机关单位等的电大教学。","[1, 2]",她,他
"而她就是从那时开始从事防艾工作的,一干就是七年。","[1, 2]",她,他
"而她脸上最初长的角化棘皮瘤,好发于长期对着太阳或曝光区的皮肤。","[1, 2]",她,他
"而她恰恰是在这样的时刻,从公司总经理升任亚洲区副总裁,可以说是临危受命。","[2, 3]",她,他
"而她只有垂死一搏,用尽所有的气力来封闭创口,以求生存。","[1, 2]",她,他
"而她自己在每天演两场戏之间见缝插针,利用一切时间向懂音乐的乐师们学习,废寝忘食地练习,整天“曲不离口”。","[1, 2]",她,他
"而现在,她只要带着身份证和储蓄卡,20多分钟就办完了这项业务。","[4, 5]",她,他
"而小雨的核磁共振和脑血管造影评估显示,此时她头上的畸形团直径已达15厘米,颈外动脉供血分支异常粗壮,随时可能爆发颅内出血。","[21, 22]",她,他
"而一路走来,别人的帮助和照顾,令她心存感恩,萌生了一定要为社会做些贡献的想法。","[16, 17]",她,他
"而在此之前,她经历了一场“残酷”的竞争：这所高中今年收到超过60份简历,最终只邀请六位应聘者面试,并从中录取两位老师。","[6, 7]",她,他
"而在此之前,她每周日上午都会准时出现在诊室中,认真询问每个病人的情况。","[6, 7]",她,他
"而在此之前,要完成这两项“任务”,她至少要跑两趟,一趟去社区事务受理中心,另一趟的目的地则是中国建设银行线下网点。","[17, 18]",她,他
"而在之前,要完成这两件事儿,她至少要跑两趟,一趟去社区事务受理中心,另一趟的目的地则是银行的线下网点。","[14, 15]",她,他
"而这,或许是因为她在2013年丢失过一次身份证。","[8, 9]",她,他
"而这次在剧中,她仿佛是得罪了造型师,要不中分厚刘海,要不光顶大额头,360度暴露了五官缺陷。","[7, 8]",她,他
而这副眼镜也一直默默地陪伴着她。,"[14, 15]",她,他
"而这时候,她同时也在为1900惋惜不已。","[5, 6]",她,他
"而这样的门诊,她一周要出三个半天。","[7, 8]",她,他
"而这种念头,也恰恰支撑着她的逃亡生涯。","[12, 13]",她,他
"而作为一名人大代表,她用相同的方法论探索代表履职之路。","[10, 11]",她,他
"二战时期,她在军中做文员工作,负责整理档案。","[5, 6]",她,他
"法官发现后,当即对她进行了制止与训诫,并责令删除所拍的照片和视频。","[9, 10]",她,他
"反复强调,不然她出门的时候,肯定是场拉锯战。","[7, 8]",她,他
"饭店老板急着找孩子要退钱给她,是因孩子善良和担当而感动,而且菜和碗“也不值几个钱”。","[36, 37]",她,他
"饭馆里的她一边计算着当天的营业额,一边思量着再推出一些大家喜爱的面食、菜品,把饭店经营得更好。","[4, 5]",她,他
"放假回家,她也会参加福安市职工志愿者协会组织的公益活动。","[5, 6]",她,他
"放心吧,她是我同事,留个工作痕迹,我们就是为了完成任务。","[5, 6]",她,他
"放学时,她总是等学生全部离校了才离开。","[4, 5]",她,他
"飞行的高空中绵延着无尽的孤独,只有星辰和月光指引着她,风暴有时还很猛烈。","[25, 26]",她,他
"费了一脑门子劲,她也想不起来。","[8, 9]",她,他
"分别时她笑眼盈盈,频频向我道谢,可我木讷到连“不客气”都说错了。","[3, 4]",她,他
"风儿轻轻吹过,树上飘落下的桂花,粒粒似上天赐予的精灵,被她满心欢喜地收集起来。","[28, 29]",她,他
"服务员端菜,她手上好像有伤口,碰到鱼背上的刺了,会被感染吗?","[7, 8]",她,他
服务员小闵向记者讲述了她遇到的这个难题。,"[14, 15]",她,他
"服用了一个月之后,她见症状已经缓解,便自行停了药物。","[9, 10]",她,他
"附近散步的住户看到后,给小区物业打电话,她才得到了消息。","[20, 21]",她,他
"该工作人员表示,她不知道物业经理的电话,无法帮助记者联系上物业经怼","[9, 10]",她,他
"该工作人员表示,因为工作较忙,她没能到现场进行把关,“出现这个事,也是大意了,没有什么经验,算是一个教训”。","[16, 17]",她,他
"该公司老板表示,当时她感觉到了不对劲,于是就下楼查看,才发现隔壁药店着火了。","[11, 12]",她,他
"概而言之,她认为木心作品最为独特之处,就是“我与世界”“我――你”关系的呈现与表达。","[5, 6]",她,他
"刚从地里回来的她,鞋子上沾满了泥巴。","[7, 8]",她,他
"刚过18岁的她并没有为自己做太多刻意的规划,希望用饱满的状态去演下一部片子就行。","[6, 7]",她,他
刚开始我还怕她在学校生活得不好、学得不好。,"[6, 7]",她,他
"刚开始只是觉得同事们玩彩票挺有趣,后来了解到了彩票的公益性,她更加坚定了购买体育彩票的信心：“不中奖,我就当娱乐之后献了一份爱心”。","[30, 31]",她,他
"刚来,手生,面对稿件,她拖动光标,一脸茫然。","[11, 12]",她,他
"刚入职的第一个月,她亲身体验了当“保姆”的不容易。","[9, 10]",她,他
"刚再婚时,宴请喝酒,人情往来,她都习惯先斩后奏,我不适应,心里憋屈。","[15, 16]",她,他
"高考完的她,第一件事就是买了一部新手机。","[4, 5]",她,他
高强度的工作使她感到疲惫但又充实快乐。,"[7, 8]",她,他
"高情商的人,遇人不淑的事件不是没有,但她会懂得及时止损。","[19, 20]",她,他
"高中毕业那年,左眼病情加重,当地医生建议她到厦门医治。","[20, 21]",她,他
"格兰小区邻里中心建成后,她成为“红领巾公益课堂”的第一位公益讲师,用活毕生数学教学经验,义务为小区孩子们进行周末数学辅导,获得如潮好评,也吸引了更多教育者加入公益队伍。","[12, 13]",她,他
"隔壁院子里的泉水,那就更走运,被挑来到她的杯子里,这不已经靠近樱桃小嘴了吗？","[19, 20]",她,他
"根据龙陵基地的土壤环境,为达到最佳甜酸比,她和基地营养组的同事们,一再实验氮、磷、钾、镁、钙等有机肥元素配比,引入椰子壳育肥,才解决了口感的关键难题。","[21, 22]",她,他
"根据她提供的优惠表,某五星级酒店的午、晚餐在团购平台显示为258元,而团购群内特价105元,折算下来能打4折。","[2, 3]",她,他
"跟随此次采访,看到数千只白天鹅翩翩起舞,这一场景是她在广州看不到的。","[25, 26]",她,他
"更令人惊讶的是,她的本职工作还是一名新闻工作者。","[8, 9]",她,他
"更令她担忧的是,由于大量检查占用了上课时间,致使本就落后的乡村教育雪上加霜,乡村的孩子们输在了起跑线上。","[2, 3]",她,他
"更让她难以忍受的是,阿强多次在其微信朋友圈发表涉及两性关系等不雅内容的评论。","[2, 3]",她,他
"工商所负责人核查后,当场向她道歉并归还了秤具。","[13, 14]",她,他
"工作没几天,她就发现两地家长在教育孩子的问题上存在很大差异,“虽然都是关爱孩子,但云阳的家长对孩子成长的关注度和关注方式还是有所欠缺”。","[6, 7]",她,他
"工作实践中,她踏实肯干,任劳任怨。","[6, 7]",她,他
"工作虽然忙碌,但她最开心的时候,就是解决了一个案子,化解了一个纠纷。","[8, 9]",她,他
"工作之后,我们轮流买礼物哄她开心,也包揽了家里所有的开销。","[13, 14]",她,他
"工作之外,她积极投身扶贫济困、苗苗助学等一系列公益活动,以自己的实际行动弘扬了“奉献、友爱、互助、进步”的志愿者精神。","[5, 6]",她,他
"工作中,她实行跟踪式保洁,确保人走蹲位清,厕内无灰尘、无蛛网、无积垢、无异味,地面无污渍,门窗玻璃洁净。","[4, 5]",她,他
"工作中,她在平凡的工作岗位上严谨求实、勤奋刻苦、兢兢业业,出色完成各项工作任务。","[4, 5]",她,他
